{
  "customer_id": "cust_john",
  "name": "John",
  "age": null,
  "gender": null,
  "marital_status": null,
  "occupation": null,
  "annual_income": null,
  "family_size": null,
  "budget": null,
  "location": null,
  "existing_policies": [],
  "preferred_category": null,
  "risk_profile": "Medium",
  "conversation_history_count": 1,
  "last_interaction": "2026-06-21T00:54:31.263240"
}